{
  "schema_version": "0.1",
  "id": "building_simple_house_001",
  "name": "Maison test M0",
  "building_type": "detached_house",
  "units": "m",
  "volumes": [
    {
      "id": "vol_main",
      "shape": "rectangular_prism",
      "position": {"x": 0.0, "y": 0.0, "z": 0.0},
      "width": 10.0,
      "depth": 8.0,
      "height": 5.6,
      "floors": 2,
      "source": {
        "kind": "user_provided",
        "confidence": 1.0
      }
    }
  ],
  "openings": [
    {
      "id": "door_front_01",
      "type": "door",
      "volume_id": "vol_main",
      "facade": "front",
      "offset_horizontal": 4.5,
      "offset_vertical": 0.0,
      "width": 1.0,
      "height": 2.1,
      "source": {
        "kind": "user_provided",
        "confidence": 1.0
      }
    },
    {
      "id": "window_front_ground_left",
      "type": "window",
      "volume_id": "vol_main",
      "facade": "front",
      "offset_horizontal": 1.5,
      "offset_vertical": 1.0,
      "width": 1.2,
      "height": 1.3,
      "source": {
        "kind": "user_provided",
        "confidence": 1.0
      }
    },
    {
      "id": "window_front_ground_right",
      "type": "window",
      "volume_id": "vol_main",
      "facade": "front",
      "offset_horizontal": 7.3,
      "offset_vertical": 1.0,
      "width": 1.2,
      "height": 1.3,
      "source": {
        "kind": "user_provided",
        "confidence": 1.0
      }
    },
    {
      "id": "window_front_upper_left",
      "type": "window",
      "volume_id": "vol_main",
      "facade": "front",
      "offset_horizontal": 2.0,
      "offset_vertical": 3.6,
      "width": 1.2,
      "height": 1.3,
      "source": {
        "kind": "user_provided",
        "confidence": 1.0
      }
    },
    {
      "id": "window_front_upper_right",
      "type": "window",
      "volume_id": "vol_main",
      "facade": "front",
      "offset_horizontal": 6.8,
      "offset_vertical": 3.6,
      "width": 1.2,
      "height": 1.3,
      "source": {
        "kind": "user_provided",
        "confidence": 1.0
      }
    }
  ],
  "roofs": [
    {
      "id": "roof_main",
      "volume_id": "vol_main",
      "type": "gable",
      "ridge_direction": "depth",
      "pitch_degrees": 35.0,
      "overhang": 0.3,
      "source": {
        "kind": "user_provided",
        "confidence": 1.0
      }
    }
  ],
  "appearance": {
    "walls": {"color": "light_beige"},
    "roof": {"color": "dark_red"},
    "frames": {"color": "white"}
  },
  "metadata": {
    "created_from": "synthetic",
    "notes": "Cas de référence pour la milestone M0"
  }
}
